campo,business_term,spiegazione,obbligatorio,numerosità,condizionalità,calcolo,offset,lunghezza,xmlpath,level,segment_group,msg_pos,segment,segment_name,segment_status,segment_max_rep,component_pos,component_type,component,component_name,component_m_c,component_format,element_repr,element_name,code_list
TAX.C533,TAX::C533 DUTY/TAX/FEE ACCOUNT DETAIL,Composite used in segment TAX (Duty/tax/fee details).,NO,1,,,,,/EDIFACT/INVOIC/DETAIL/SG32/TAX/C533,DETAIL,SG32,1320,TAX,Duty/tax/fee details,M,1,030,COMPOSITE,C533,DUTY/TAX/FEE ACCOUNT DETAIL,C,,,,
TAX.5286,Duty/tax/fee assessment basis,DUTY/TAX/FEE ASSESSMENT BASIS (in segment TAX Duty/tax/fee details).,NO,1,,,,an..15,/EDIFACT/INVOIC/DETAIL/SG32/TAX/5286,DETAIL,SG32,1320,TAX,Duty/tax/fee details,M,1,040,ELEMENT,5286,DUTY/TAX/FEE ASSESSMENT BASIS,C,an..15,an..15,Duty/tax/fee assessment basis,
TAX.C243,TAX::C243 DUTY/TAX/FEE DETAIL,Composite used in segment TAX (Duty/tax/fee details).,NO,1,,,,,/EDIFACT/INVOIC/DETAIL/SG32/TAX/C243,DETAIL,SG32,1320,TAX,Duty/tax/fee details,M,1,050,COMPOSITE,C243,DUTY/TAX/FEE DETAIL,C,,,,
TAX.5305,"Duty/tax/fee category, coded","DUTY/TAX/FEE CATEGORY, CODED (in segment TAX Duty/tax/fee details).",NO,1,,,,an..3,/EDIFACT/INVOIC/DETAIL/SG32/TAX/5305,DETAIL,SG32,1320,TAX,Duty/tax/fee details,M,1,060,ELEMENT,5305,"DUTY/TAX/FEE CATEGORY, CODED",C,an..3,an..3,"Duty/tax/fee category, coded",
TAX.3446,Party tax identification number,PARTY TAX IDENTIFICATION NUMBER (in segment TAX Duty/tax/fee details).,NO,1,,,,an..20,/EDIFACT/INVOIC/DETAIL/SG32/TAX/3446,DETAIL,SG32,1320,TAX,Duty/tax/fee details,M,1,070,ELEMENT,3446,PARTY TAX IDENTIFICATION NUMBER,C,an..20,an..20,Party tax identification number,
MOA.C516,MOA::C516 MONETARY AMOUNT,Composite used in segment MOA (Monetary amount).,SI,1,,,,,/EDIFACT/INVOIC/DETAIL/SG32/MOA/C516,DETAIL,SG32,1330,MOA,Monetary amount,C,1,010,COMPOSITE,C516,MONETARY AMOUNT,M,,,,
LOC.3227,Place/location qualifier,PLACE/LOCATION QUALIFIER (in segment LOC Place/location identification).,SI,5,,,,an..3,/EDIFACT/INVOIC/DETAIL/SG32/LOC/3227,DETAIL,SG32,1340,LOC,Place/location identification,C,5,010,ELEMENT,3227,PLACE/LOCATION QUALIFIER,M,an..3,an..3,Place/location qualifier,ZZZ=Mutually defined | DO=Domestic | DR=Domestic with regulatory information required | EA=Economic area | IN=International | IR=International with regulatory information required
LOC.C517,LOC::C517 LOCATION IDENTIFICATION,Composite used in segment LOC (Place/location identification).,NO,5,,,,,/EDIFACT/INVOIC/DETAIL/SG32/LOC/C517,DETAIL,SG32,1340,LOC,Place/location identification,C,5,020,COMPOSITE,C517,LOCATION IDENTIFICATION,C,,,,
LOC.C519,LOC::C519 RELATED LOCATION ONE IDENTIFICATION,Composite used in segment LOC (Place/location identification).,NO,5,,,,,/EDIFACT/INVOIC/DETAIL/SG32/LOC/C519,DETAIL,SG32,1340,LOC,Place/location identification,C,5,030,COMPOSITE,C519,RELATED LOCATION ONE IDENTIFICATION,C,,,,
LOC.C553,LOC::C553 RELATED LOCATION TWO IDENTIFICATION,Composite used in segment LOC (Place/location identification).,NO,5,,,,,/EDIFACT/INVOIC/DETAIL/SG32/LOC/C553,DETAIL,SG32,1340,LOC,Place/location identification,C,5,040,COMPOSITE,C553,RELATED LOCATION TWO IDENTIFICATION,C,,,,
LOC.5479,"Relation, coded","RELATION, CODED (in segment LOC Place/location identification).",NO,5,,,,n..10,/EDIFACT/INVOIC/DETAIL/SG32/LOC/5479,DETAIL,SG32,1340,LOC,Place/location identification,C,5,050,ELEMENT,5479,"RELATION, CODED",C,an..3,n..10,"Relation, coded",
NAD.3035,Party qualifier,PARTY QUALIFIER (in segment NAD Name and address).,SI,1,,,,an..3,/EDIFACT/INVOIC/DETAIL/SG34/NAD/3035,DETAIL,SG34,1360,NAD,Name and address,M,1,010,ELEMENT,3035,PARTY QUALIFIER,M,an..3,an..3,Party qualifier,"AA=Party to be billed (AAR Accounting rule 11) | AB=Buyer's agent/representative | AE=Declarant's agent/representative | AF=Transit principal | AG=Agent/representative | AH=Transit principal's agent/representative | AI=Successful job applicant | AK=Acknowledgement recipient | AL=Principal | AM=Authorized official | AN=Approved importer | AO=Account of | AP=Accepting party | AQ=Approved consignor | AR=Authorized exporter | AT=Authorized importer | AU=Authorized trader (transit) | AV=Authorizing official | AW=Applicant's bank | AX=Authenticating party | AZ=Issuing bank | B1=Contact bank 1 | B2=Contact bank 2 | BA=Booking agent | BB=Buyer's bank | BC=Negotiating bank | BD=Documentary credit reimbursing bank | BE=Beneficiary | BF=Beneficiary's bank | BG=Employer | BH=Previous employer | BI=Buyer's financial institution | BK=Financial institution | BL=Bill of lading recipient | BM=Insured | BN=Insurance beneficiary | BO=Broker or sales office | BP=Building site purchaser | BQ=Cheque drawn bank | BS=Bill and ship to | BT=Party to be billed for other than freight (bill to) | BU=Service bureau | BV=Member | BW=Borrower | BX=Building site engineer | BY=Buyer | BZ=Building site forwarder | C1=In care of party no. 1 | C2=In care of party no. 2 | CA=Carrier | CB=Customs broker | CC=Claimant | CD=Agent's bank | CE=Ceding company | CF=Container operator/lessee | CG=Carrier's agent | CH=Connecting carrier | CI=Commission processor | CJ=Previous member | CK=Empty equipment despatch party | CL=Container location party | CM=Customs | CN=Consignee | CO=Corporate office | COP=Convoying party | CP=Party to receive certificate of compliance | CPD=Charges payer at destination | CQ=Cheque order | CR=Empty equipment return party | CS=Consolidator | CT=Consignee to be specified | CU=Container return company | CV=Consignee of vessel | CW=Equipment owner | CX=Consignee's agent | CY=Commissionable agent | CZ=Consignor | DA=Available with bank (documentary credits) | DB=Distributor branch | DC=Deconsolidator | DCP=Despatch charge payer | DD=Documentary credit account party's bank | DE=Depositor | DF=Documentary credit applicant | DG=Documentary credit beneficiary | DH=Documentary credit account party | DI=Documentary credit second beneficiary | DJ=Party according to documentary credit transaction | DK=Documentary credit beneficiary's bank | DL=Factor | DM=Party to whom documents are to be presented | DN=Owner of operation | DO=Document recipient | DP=Delivery party | DQ=Owner's agent | DR=Driver | DS=Distributor | DT=Declarant | DU=Owner's representative | DV=Project management office | DW=Drawee | DX=Engineer (construction) | DY=Engineer, resident (construction) | DZ=Architect | EA=Architect-designer | EB=Building inspectorate | EC=Exchanger | ED=Engineer, consultant | EE=Location of goods for customs examination before clearance | EF=Project coordination office | EG=Surveyor, topographical | EH=Engineer, measurement | EI=Controller, quality | EJ=Surveyor, quantity | EK=Surveyor (professional), quantity | EL=Project | EM=Party to receive electronic memo of invoice | EN=Tenderer | EO=Owner of equipment | EP=Equipment drop-off party | EQ=Empty container responsible party | ER=Empty container return agent | ES=Contractor, lead | ET=Co-contractor | EU=Contractor, general | EV=Subcontractor | EW=Subcontractor with direct payment | EX=Exporter | EY=Subcontractor, nominated | EZ=Operator, essential services | FA=Operator, communication channel | FB=Nominated freight company | FC=Contractor, main | FD=Buyer's parent company | FE=Credit rating agency | FF=Factor, correspondent | FG=Buyer as officially registered | FH=Seller as officially registered | FJ=Trade Union | FK=Previous Trade Union | FL=Passenger | FM=Crew member | FN=Tariff issuer | FO=Party performing inspection | FP=Freight/charges payer | FR=Message from | FT=Party responsible for financial settlement | FW=Freight forwarder | FX=Current receiver | FY=Current sender | FZ=Grouping centre | GA=Road carrier | GB=Chamber of commerce | GC=Goods custodian | GD=Producer | GE=Registration tribunal | GF=Slot charter party | GG=Warehouse | GH=Applicant for job | GI=Spouse | GJ=Mother | GK=Father | GL=Socially insured person | GM=Inventory controller | GN=Processor | GO=Goods owner | GP=Packer | GQ=Slaughterer | GR=Goods releaser | GS=Consignor's representative | GT=Rail carrier | I1=Intermediary bank 1 | I2=Intermediary bank 2 | IB=Intermediary/broker | IC=Intermediate consignee | II=Issuer of invoice | IM=Importer | IN=Insurer | IO=Insurance company | IP=Insurance claim adjuster | IS=Party to receive certified inspection report | IT=Installation on site | IV=Invoicee | LA=Party designated to provide living animal care | LN=Lender | LP=Loading party | MA=Party for whom item is ultimately intended | MF=Manufacturer of goods | MG=Party designated to execute re-icing | MI=Planning schedule/material release issuer | MP=Manufacturing plant | MR=Message recipient | MS=Document/message issuer/sender | MT=Party designated to execute sanitary procedures | N1=Notify party no. 1 | N2=Notify party no. 2 | NI=Notify party | OA=Break bulk berth operator | OB=Ordered by | OF=On behalf of | OI=Outside inspection agency | OO=Order of shipper | OP=Operator of property or unit | OR=Ordered bank | OS=Original shipper | OT=Outside test agency | OV=Owner of means of transport | OY=Ordering customer | P1=Contact party 1 | P2=Contact party 2 | P3=Contact party 3 | P4=Contact party 4 | PA=Party to receive inspection report | PB=Paying financial institution | PC=Actual purchaser's customer | PD=Purchaser's department buyer | PE=Payee | PF=Party to receive freight bill | PG=Prime contractor | PH=Payer's financial institution | PI=Payee's company name/ID | PJ=Party to receive correspondence | PK=Contact party | PL=Payor | PM=Party to receive paper memo of invoice | PN=Party to receive shipping notice | PO=Ordering party | PQ=Certifying party | PR=Payer | PS=Payer's company name/ID (Check, Draft or Wire) | PT=Party to receive test report | PW=Despatch party | PX=Party to receive all documents | PY=Checking party | PZ=Party to print some document | RA=Central bank or regulatory authority | RB=Receiving financial institution | RE=Party to receive commercial invoice remittance | RF=Received from | RH=Seller's financial institution | RI=Reinsurance intermediary/broker | RL=Reporting carrier (Customs) | RM=Reporting carrier's nominated agent/representative (Customs) | RP=Routing party | RS=Party to receive statement of account | RV=Receiver of cheque | RW=Issuer of waybill | SB=Sales responsibility | SE=Seller | SF=Ship from | SG=Store group | SI=Shipping schedule issuer | SK=Plant | SN=Store keeper | SO=Sold to if different than bill to | SR=Seller's agent/representative | SS=Social securities collector's office | ST=Ship to | SU=Supplier | SX=Surety for additions | SY=Surety | SZ=Surety for antidumping/countervailing duty | TC=Tax collector's office | TCP=Transit charge payer | TD=Party to receive technical documentation | TR=Terminal operator | TS=Party to receive certified test results | TT=Transfer to | UC=Ultimate consignee | UD=Ultimate customer | UHP=Unexpected handling party | UP=Unloading party | VN=Vendor | WD=Warehouse depositor | WH=Warehouse keeper | WM=Works manager | WPA=Weighting party | WS=Wholesaler | XX=No heading | ZZZ=Mutually defined"
NAD.C082,NAD::C082 PARTY IDENTIFICATION DETAILS,Composite used in segment NAD (Name and address).,NO,1,,,,,/EDIFACT/INVOIC/DETAIL/SG34/NAD/C082,DETAIL,SG34,1360,NAD,Name and address,M,1,020,COMPOSITE,C082,PARTY IDENTIFICATION DETAILS,C,,,,
NAD.C058,NAD::C058 NAME AND ADDRESS,Composite used in segment NAD (Name and address).,NO,1,,,,,/EDIFACT/INVOIC/DETAIL/SG34/NAD/C058,DETAIL,SG34,1360,NAD,Name and address,M,1,030,COMPOSITE,C058,NAME AND ADDRESS,C,,,,
NAD.C080,NAD::C080 PARTY NAME,Composite used in segment NAD (Name and address).,NO,1,,,,,/EDIFACT/INVOIC/DETAIL/SG34/NAD/C080,DETAIL,SG34,1360,NAD,Name and address,M,1,040,COMPOSITE,C080,PARTY NAME,C,,,,
NAD.C059,NAD::C059 STREET,Composite used in segment NAD (Name and address).,NO,1,,,,,/EDIFACT/INVOIC/DETAIL/SG34/NAD/C059,DETAIL,SG34,1360,NAD,Name and address,M,1,050,COMPOSITE,C059,STREET,C,,,,
NAD.3164,City name,CITY NAME (in segment NAD Name and address).,NO,1,,,,an..35,/EDIFACT/INVOIC/DETAIL/SG34/NAD/3164,DETAIL,SG34,1360,NAD,Name and address,M,1,060,ELEMENT,3164,CITY NAME,C,an..35,an..35,City name,
NAD.3229,Country sub-entity identification,COUNTRY SUB-ENTITY IDENTIFICATION (in segment NAD Name and address).,NO,1,,,,an..9,/EDIFACT/INVOIC/DETAIL/SG34/NAD/3229,DETAIL,SG34,1360,NAD,Name and address,M,1,070,ELEMENT,3229,COUNTRY SUB-ENTITY IDENTIFICATION,C,an..9,an..9,Country sub-entity identification,
NAD.3251,Postcode identification,POSTCODE IDENTIFICATION (in segment NAD Name and address).,NO,1,,,,an..9,/EDIFACT/INVOIC/DETAIL/SG34/NAD/3251,DETAIL,SG34,1360,NAD,Name and address,M,1,080,ELEMENT,3251,POSTCODE IDENTIFICATION,C,an..9,an..9,Postcode identification,
NAD.3207,"Country, coded","COUNTRY, CODED (in segment NAD Name and address).",NO,1,,,,an..3,/EDIFACT/INVOIC/DETAIL/SG34/NAD/3207,DETAIL,SG34,1360,NAD,Name and address,M,1,090,ELEMENT,3207,"COUNTRY, CODED",C,an..3,an..3,"Country, coded",
LOC.3227,Place/location qualifier,PLACE/LOCATION QUALIFIER (in segment LOC Place/location identification).,SI,5,,,,an..3,/EDIFACT/INVOIC/DETAIL/SG34/LOC/3227,DETAIL,SG34,1370,LOC,Place/location identification,C,5,010,ELEMENT,3227,PLACE/LOCATION QUALIFIER,M,an..3,an..3,Place/location qualifier,ZZZ=Mutually defined | DO=Domestic | DR=Domestic with regulatory information required | EA=Economic area | IN=International | IR=International with regulatory information required
LOC.C517,LOC::C517 LOCATION IDENTIFICATION,Composite used in segment LOC (Place/location identification).,NO,5,,,,,/EDIFACT/INVOIC/DETAIL/SG34/LOC/C517,DETAIL,SG34,1370,LOC,Place/location identification,C,5,020,COMPOSITE,C517,LOCATION IDENTIFICATION,C,,,,
LOC.C519,LOC::C519 RELATED LOCATION ONE IDENTIFICATION,Composite used in segment LOC (Place/location identification).,NO,5,,,,,/EDIFACT/INVOIC/DETAIL/SG34/LOC/C519,DETAIL,SG34,1370,LOC,Place/location identification,C,5,030,COMPOSITE,C519,RELATED LOCATION ONE IDENTIFICATION,C,,,,
LOC.C553,LOC::C553 RELATED LOCATION TWO IDENTIFICATION,Composite used in segment LOC (Place/location identification).,NO,5,,,,,/EDIFACT/INVOIC/DETAIL/SG34/LOC/C553,DETAIL,SG34,1370,LOC,Place/location identification,C,5,040,COMPOSITE,C553,RELATED LOCATION TWO IDENTIFICATION,C,,,,
LOC.5479,"Relation, coded","RELATION, CODED (in segment LOC Place/location identification).",NO,5,,,,n..10,/EDIFACT/INVOIC/DETAIL/SG34/LOC/5479,DETAIL,SG34,1370,LOC,Place/location identification,C,5,050,ELEMENT,5479,"RELATION, CODED",C,an..3,n..10,"Relation, coded",
RFF.C506,RFF::C506 REFERENCE,Composite used in segment RFF (Reference).,SI,1,,,,,/EDIFACT/INVOIC/DETAIL/SG35/RFF/C506,DETAIL,SG35,1390,RFF,Reference,M,1,010,COMPOSITE,C506,REFERENCE,M,,,,
DTM.C507,DTM::C507 DATE/TIME/PERIOD,Composite used in segment DTM (Date/time/period).,SI,5,,,,,/EDIFACT/INVOIC/DETAIL/SG35/DTM/C507,DETAIL,SG35,1400,DTM,Date/time/period,C,5,010,COMPOSITE,C507,DATE/TIME/PERIOD,M,,,,
DOC.C002,DOC::C002 DOCUMENT/MESSAGE NAME,Composite used in segment DOC (Document/message details).,SI,1,,,,,/EDIFACT/INVOIC/DETAIL/SG36/DOC/C002,DETAIL,SG36,1420,DOC,Document/message details,M,1,010,COMPOSITE,C002,DOCUMENT/MESSAGE NAME,M,,,,
DOC.C503,DOC::C503 DOCUMENT/MESSAGE DETAILS,Composite used in segment DOC (Document/message details).,NO,1,,,,,/EDIFACT/INVOIC/DETAIL/SG36/DOC/C503,DETAIL,SG36,1420,DOC,Document/message details,M,1,020,COMPOSITE,C503,DOCUMENT/MESSAGE DETAILS,C,,,,
DOC.3153,"Communication channel identifier, coded","COMMUNICATION CHANNEL IDENTIFIER, CODED (in segment DOC Document/message details).",NO,1,,,,an..3,/EDIFACT/INVOIC/DETAIL/SG36/DOC/3153,DETAIL,SG36,1420,DOC,Document/message details,M,1,030,ELEMENT,3153,"COMMUNICATION CHANNEL IDENTIFIER, CODED",C,an..3,an..3,"Communication channel identifier, coded",
DOC.1220,Number of copies of document required,NUMBER OF COPIES OF DOCUMENT REQUIRED (in segment DOC Document/message details).,NO,1,,,,n..2,/EDIFACT/INVOIC/DETAIL/SG36/DOC/1220,DETAIL,SG36,1420,DOC,Document/message details,M,1,040,ELEMENT,1220,NUMBER OF COPIES OF DOCUMENT REQUIRED,C,n..2,n..2,Number of copies of document required,
DOC.1218,Number of originals of document required,NUMBER OF ORIGINALS OF DOCUMENT REQUIRED (in segment DOC Document/message details).,NO,1,,,,n..2,/EDIFACT/INVOIC/DETAIL/SG36/DOC/1218,DETAIL,SG36,1420,DOC,Document/message details,M,1,050,ELEMENT,1218,NUMBER OF ORIGINALS OF DOCUMENT REQUIRED,C,n..2,n..2,Number of originals of document required,
DTM.C507,DTM::C507 DATE/TIME/PERIOD,Composite used in segment DTM (Date/time/period).,SI,5,,,,,/EDIFACT/INVOIC/DETAIL/SG36/DTM/C507,DETAIL,SG36,1430,DTM,Date/time/period,C,5,010,COMPOSITE,C507,DATE/TIME/PERIOD,M,,,,
CTA.3139,"Contact function, coded","CONTACT FUNCTION, CODED (in segment CTA Contact information).",NO,1,,,,an..512,/EDIFACT/INVOIC/DETAIL/SG37/CTA/3139,DETAIL,SG37,1450,CTA,Contact information,M,1,010,ELEMENT,3139,"CONTACT FUNCTION, CODED",C,an..3,an..512,"Contact function, coded",
CTA.C056,CTA::C056 DEPARTMENT OR EMPLOYEE DETAILS,Composite used in segment CTA (Contact information).,NO,1,,,,,/EDIFACT/INVOIC/DETAIL/SG37/CTA/C056,DETAIL,SG37,1450,CTA,Contact information,M,1,020,COMPOSITE,C056,DEPARTMENT OR EMPLOYEE DETAILS,C,,,,
COM.C076,COM::C076 COMMUNICATION CONTACT,Composite used in segment COM (Communication contact).,SI,5,,,,,/EDIFACT/INVOIC/DETAIL/SG37/COM/C076,DETAIL,SG37,1460,COM,Communication contact,C,5,010,COMPOSITE,C076,COMMUNICATION CONTACT,M,,,,
ALC.5463,Allowance or charge qualifier,ALLOWANCE OR CHARGE QUALIFIER (in segment ALC Allowance or charge).,SI,1,,,,an..3,/EDIFACT/INVOIC/DETAIL/SG38/ALC/5463,DETAIL,SG38,1480,ALC,Allowance or charge,M,1,010,ELEMENT,5463,ALLOWANCE OR CHARGE QUALIFIER,M,an..3,an..3,Allowance or charge qualifier,
ALC.C552,ALC::C552 ALLOWANCE/CHARGE INFORMATION,Composite used in segment ALC (Allowance or charge).,NO,1,,,,,/EDIFACT/INVOIC/DETAIL/SG38/ALC/C552,DETAIL,SG38,1480,ALC,Allowance or charge,M,1,020,COMPOSITE,C552,ALLOWANCE/CHARGE INFORMATION,C,,,,
ALC.4471,"Settlement, coded","SETTLEMENT, CODED (in segment ALC Allowance or charge).",NO,1,,,,an..3,/EDIFACT/INVOIC/DETAIL/SG38/ALC/4471,DETAIL,SG38,1480,ALC,Allowance or charge,M,1,030,ELEMENT,4471,"SETTLEMENT, CODED",C,an..3,an..3,"Settlement, coded",
ALC.1227,"Calculation sequence indicator, coded","CALCULATION SEQUENCE INDICATOR, CODED (in segment ALC Allowance or charge).",NO,1,,,,an..3,/EDIFACT/INVOIC/DETAIL/SG38/ALC/1227,DETAIL,SG38,1480,ALC,Allowance or charge,M,1,040,ELEMENT,1227,"CALCULATION SEQUENCE INDICATOR, CODED",C,an..3,an..3,"Calculation sequence indicator, coded",
ALC.C214,ALC::C214 SPECIAL SERVICES IDENTIFICATION,Composite used in segment ALC (Allowance or charge).,NO,1,,,,,/EDIFACT/INVOIC/DETAIL/SG38/ALC/C214,DETAIL,SG38,1480,ALC,Allowance or charge,M,1,050,COMPOSITE,C214,SPECIAL SERVICES IDENTIFICATION,C,,,,
ALI.3239,"Country of origin, coded","COUNTRY OF ORIGIN, CODED (in segment ALI Additional information).",NO,5,,,,an..3,/EDIFACT/INVOIC/DETAIL/SG38/ALI/3239,DETAIL,SG38,1490,ALI,Additional information,C,5,010,ELEMENT,3239,"COUNTRY OF ORIGIN, CODED",C,an..3,an..3,"Country of origin, coded",
ALI.9213,"Type of duty regime, coded","TYPE OF DUTY REGIME, CODED (in segment ALI Additional information).",NO,5,,,,an..3,/EDIFACT/INVOIC/DETAIL/SG38/ALI/9213,DETAIL,SG38,1490,ALI,Additional information,C,5,020,ELEMENT,9213,"TYPE OF DUTY REGIME, CODED",C,an..3,an..3,"Type of duty regime, coded",
ALI.4183,"Special conditions, coded","SPECIAL CONDITIONS, CODED (in segment ALI Additional information).",NO,5,,,,an..3,/EDIFACT/INVOIC/DETAIL/SG38/ALI/4183,DETAIL,SG38,1490,ALI,Additional information,C,5,030,ELEMENT,4183,"SPECIAL CONDITIONS, CODED",C,an..3,an..3,"Special conditions, coded","A=Account | CA=Advance collect | CC=Collect | CF=Collect, freight credited to payment customer | DF=Defined by buyer and seller | FO=FOB port of call | IC=Information copy, no payment due | MX=Mixed | NC=Service freight, no charge | NS=Not specified | PA=Advance prepaid | PB=Customer pick-up/backhaul | PC=Prepaid but charged to customer | PE=Payable elsewhere | PO=Prepaid only | PP=Prepaid (by seller) | PU=Pickup | RC=Return container freight paid by customer | RF=Return container freight free | RS=Return container freight paid by supplier | TP=Third party pay | WC=Weight condition | ZZZ=Mutually defined"
ALI.4183,"Special conditions, coded","SPECIAL CONDITIONS, CODED (in segment ALI Additional information).",NO,5,,,,an..3,/EDIFACT/INVOIC/DETAIL/SG38/ALI/4183,DETAIL,SG38,1490,ALI,Additional information,C,5,040,ELEMENT,4183,"SPECIAL CONDITIONS, CODED",C,an..3,an..3,"Special conditions, coded","A=Account | CA=Advance collect | CC=Collect | CF=Collect, freight credited to payment customer | DF=Defined by buyer and seller | FO=FOB port of call | IC=Information copy, no payment due | MX=Mixed | NC=Service freight, no charge | NS=Not specified | PA=Advance prepaid | PB=Customer pick-up/backhaul | PC=Prepaid but charged to customer | PE=Payable elsewhere | PO=Prepaid only | PP=Prepaid (by seller) | PU=Pickup | RC=Return container freight paid by customer | RF=Return container freight free | RS=Return container freight paid by supplier | TP=Third party pay | WC=Weight condition | ZZZ=Mutually defined"
ALI.4183,"Special conditions, coded","SPECIAL CONDITIONS, CODED (in segment ALI Additional information).",NO,5,,,,an..3,/EDIFACT/INVOIC/DETAIL/SG38/ALI/4183,DETAIL,SG38,1490,ALI,Additional information,C,5,050,ELEMENT,4183,"SPECIAL CONDITIONS, CODED",C,an..3,an..3,"Special conditions, coded","A=Account | CA=Advance collect | CC=Collect | CF=Collect, freight credited to payment customer | DF=Defined by buyer and seller | FO=FOB port of call | IC=Information copy, no payment due | MX=Mixed | NC=Service freight, no charge | NS=Not specified | PA=Advance prepaid | PB=Customer pick-up/backhaul | PC=Prepaid but charged to customer | PE=Payable elsewhere | PO=Prepaid only | PP=Prepaid (by seller) | PU=Pickup | RC=Return container freight paid by customer | RF=Return container freight free | RS=Return container freight paid by supplier | TP=Third party pay | WC=Weight condition | ZZZ=Mutually defined"
ALI.4183,"Special conditions, coded","SPECIAL CONDITIONS, CODED (in segment ALI Additional information).",NO,5,,,,an..3,/EDIFACT/INVOIC/DETAIL/SG38/ALI/4183,DETAIL,SG38,1490,ALI,Additional information,C,5,060,ELEMENT,4183,"SPECIAL CONDITIONS, CODED",C,an..3,an..3,"Special conditions, coded","A=Account | CA=Advance collect | CC=Collect | CF=Collect, freight credited to payment customer | DF=Defined by buyer and seller | FO=FOB port of call | IC=Information copy, no payment due | MX=Mixed | NC=Service freight, no charge | NS=Not specified | PA=Advance prepaid | PB=Customer pick-up/backhaul | PC=Prepaid but charged to customer | PE=Payable elsewhere | PO=Prepaid only | PP=Prepaid (by seller) | PU=Pickup | RC=Return container freight paid by customer | RF=Return container freight free | RS=Return container freight paid by supplier | TP=Third party pay | WC=Weight condition | ZZZ=Mutually defined"
ALI.4183,"Special conditions, coded","SPECIAL CONDITIONS, CODED (in segment ALI Additional information).",NO,5,,,,an..3,/EDIFACT/INVOIC/DETAIL/SG38/ALI/4183,DETAIL,SG38,1490,ALI,Additional information,C,5,070,ELEMENT,4183,"SPECIAL CONDITIONS, CODED",C,an..3,an..3,"Special conditions, coded","A=Account | CA=Advance collect | CC=Collect | CF=Collect, freight credited to payment customer | DF=Defined by buyer and seller | FO=FOB port of call | IC=Information copy, no payment due | MX=Mixed | NC=Service freight, no charge | NS=Not specified | PA=Advance prepaid | PB=Customer pick-up/backhaul | PC=Prepaid but charged to customer | PE=Payable elsewhere | PO=Prepaid only | PP=Prepaid (by seller) | PU=Pickup | RC=Return container freight paid by customer | RF=Return container freight free | RS=Return container freight paid by supplier | TP=Third party pay | WC=Weight condition | ZZZ=Mutually defined"
DTM.C507,DTM::C507 DATE/TIME/PERIOD,Composite used in segment DTM (Date/time/period).,SI,5,,,,,/EDIFACT/INVOIC/DETAIL/SG38/DTM/C507,DETAIL,SG38,1500,DTM,Date/time/period,C,5,010,COMPOSITE,C507,DATE/TIME/PERIOD,M,,,,
QTY.C186,QTY::C186 QUANTITY DETAILS,Composite used in segment QTY (Quantity).,SI,1,,,,,/EDIFACT/INVOIC/DETAIL/SG39/QTY/C186,DETAIL,SG39,1520,QTY,Quantity,M,1,010,COMPOSITE,C186,QUANTITY DETAILS,M,,,,
RNG.6167,Range type qualifier,RANGE TYPE QUALIFIER (in segment RNG Range details).,SI,1,,,,an..3,/EDIFACT/INVOIC/DETAIL/SG39/RNG/6167,DETAIL,SG39,1530,RNG,Range details,C,1,010,ELEMENT,6167,RANGE TYPE QUALIFIER,M,an..3,an..3,Range type qualifier,
RNG.C280,RNG::C280 RANGE,Composite used in segment RNG (Range details).,NO,1,,,,,/EDIFACT/INVOIC/DETAIL/SG39/RNG/C280,DETAIL,SG39,1530,RNG,Range details,C,1,020,COMPOSITE,C280,RANGE,C,,,,
PCD.C501,PCD::C501 PERCENTAGE DETAILS,Composite used in segment PCD (Percentage details).,SI,1,,,,,/EDIFACT/INVOIC/DETAIL/SG40/PCD/C501,DETAIL,SG40,1550,PCD,Percentage details,M,1,010,COMPOSITE,C501,PERCENTAGE DETAILS,M,,,,
RNG.6167,Range type qualifier,RANGE TYPE QUALIFIER (in segment RNG Range details).,SI,1,,,,an..3,/EDIFACT/INVOIC/DETAIL/SG40/RNG/6167,DETAIL,SG40,1560,RNG,Range details,C,1,010,ELEMENT,6167,RANGE TYPE QUALIFIER,M,an..3,an..3,Range type qualifier,
RNG.C280,RNG::C280 RANGE,Composite used in segment RNG (Range details).,NO,1,,,,,/EDIFACT/INVOIC/DETAIL/SG40/RNG/C280,DETAIL,SG40,1560,RNG,Range details,C,1,020,COMPOSITE,C280,RANGE,C,,,,
MOA.C516,MOA::C516 MONETARY AMOUNT,Composite used in segment MOA (Monetary amount).,SI,1,,,,,/EDIFACT/INVOIC/DETAIL/SG41/MOA/C516,DETAIL,SG41,1580,MOA,Monetary amount,M,1,010,COMPOSITE,C516,MONETARY AMOUNT,M,,,,
RNG.6167,Range type qualifier,RANGE TYPE QUALIFIER (in segment RNG Range details).,SI,1,,,,an..3,/EDIFACT/INVOIC/DETAIL/SG41/RNG/6167,DETAIL,SG41,1590,RNG,Range details,C,1,010,ELEMENT,6167,RANGE TYPE QUALIFIER,M,an..3,an..3,Range type qualifier,
